{"$schema":"https://json-schema.org/draft/2020-12/schema","$id":"https://thedailyline.bet/schemas/video/v1/voice-package.schema.json","title":"VoicePackage","type":"object","additionalProperties":false,"required":["schema_version","voice_package_id","script_id","voice_profile_ref","provider_ref","model_ref","audio_asset_ref","content_hash","duration_ms","segment_timing_refs","created_at","voice_digest"],"properties":{"schema_version":{"const":"voice-package.v1"},"voice_package_id":{"$ref":"common.schema.json#/$defs/Id"},"script_id":{"$ref":"common.schema.json#/$defs/Ref"},"voice_profile_ref":{"$ref":"common.schema.json#/$defs/Ref"},"provider_ref":{"$ref":"common.schema.json#/$defs/Ref"},"model_ref":{"$ref":"common.schema.json#/$defs/Ref"},"audio_asset_ref":{"$ref":"common.schema.json#/$defs/Ref"},"content_hash":{"$ref":"common.schema.json#/$defs/Digest"},"duration_ms":{"type":"integer","minimum":0},"segment_timing_refs":{"$ref":"common.schema.json#/$defs/RefSet"},"created_at":{"$ref":"common.schema.json#/$defs/Timestamp"},"voice_digest":{"$ref":"common.schema.json#/$defs/Digest"}}}
