{"schema_version":"voice-package.v1","voice_package_id":"voice.fixture.001","script_id":"script.mlb.sf-lad.1a","voice_profile_ref":"analyst-neutral.v1","provider_ref":"tts.fixture","model_ref":"tts-model.fixture","audio_asset_ref":"artifact://audio/voice.fixture.001.wav","content_hash":"sha256:c57d7e92019708b614c90fa3685cd644f543a60153fb99ec9b67c381a245fb2a","duration_ms":14250,"segment_timing_refs":["seg.hook","seg.reason","seg.pick","seg.outro"],"created_at":"2026-09-08T16:09:00Z","voice_digest":"sha256:9b3abbc8a5ceb3b04cd20e2ed8d88d0da2c451e309467cb0532b2cf7bfb32c59"}
